{
  "topic": "LLM Agent Orchestration",
  "literature_map_ref": "paper/output/literature_map.json",
  "gaps": [
    {
      "gap_id": "GAP-001",
      "description": "Eighteen multi-agent frameworks exist (AutoGen, MetaGPT, ChatDev, AgentVerse, DyLAN, AFlow, etc.) and six evaluation benchmarks assess agent capabilities (AgentBench, SWE-bench, GAIA, WebArena), yet zero papers systematically compare orchestration topologies head-to-head on standardized benchmarks. The field lacks empirical evidence for which orchestration strategy (flat conversation, hierarchical SOP, role-playing, DAG-based, RL-orchestrated) suits which task type, leaving framework selection entirely unprincipled.",
      "cluster_a": {
        "name": "multi-agent-frameworks",
        "description": "Frameworks and architectures for orchestrating multiple LLM agents including conversation-based, SOP-based, role-playing, and hierarchical multi-agent systems for collaborative task solving.",
        "key_papers": [
          "ARXIV-2308.08155",
          "ARXIV-2308.00352",
          "ARXIV-2303.17760",
          "ARXIV-2307.07924",
          "ARXIV-2505.19591"
        ]
      },
      "cluster_b": {
        "name": "evaluation-benchmarks",
        "description": "Benchmarks and evaluation frameworks for assessing LLM agent capabilities across coding, web navigation, general assistance, and multi-turn interaction scenarios.",
        "key_papers": [
          "ARXIV-2308.03688",
          "ARXIV-2310.06692",
          "ARXIV-2311.12983",
          "ARXIV-2307.13854",
          "ARXIV-2507.21504"
        ]
      },
      "novelty_score": 9.0,
      "novelty_justification": "Zero cross-cluster citation edges exist between multi-agent-frameworks (18 papers) and evaluation-benchmarks (6 papers). Co-citation proximity is zero: no paper in the corpus references works from both clusters simultaneously. All existing benchmarks evaluate single-agent performance; the evaluation survey (ARXIV-2507.21504) explicitly notes orchestration evaluation as underexplored. The MAD analysis (ARXIV-2311.08590) is the closest precedent but only covers debate, not orchestration topology comparison.",
      "evidence": [
        "ARXIV-2308.08155",
        "ARXIV-2308.00352",
        "ARXIV-2308.03688",
        "ARXIV-2307.13854",
        "ARXIV-2311.08590",
        "ARXIV-2507.21504"
      ],
      "feasibility": {
        "score": 8,
        "assessment": "Both clusters provide baseline papers for comparison. Public benchmark suites (AgentBench, SWE-bench, GAIA, WebArena) are available and well-documented. Gap is well-scoped between two defined clusters. Related work involves larger teams (MetaGPT: 15 authors, AgentBench: 22 authors), but a single author can implement 3-4 orchestration topologies as lightweight wrappers and run them on existing benchmarks. The key challenge is controlled experimental design to isolate topology effects from LLM capability differences.",
        "required_resources": [
          "Baseline implementations from both clusters (AutoGen, MetaGPT, flat/hierarchical topologies)",
          "Public benchmark suites: AgentBench, GAIA, WebArena (all open-source)",
          "API access for LLM evaluation (GPT-4, Claude, or open-source models)",
          "Compute for running ~500-1000 benchmark instances across topologies"
        ]
      },
      "recommended_framing": "A controlled empirical study that implements 4-5 canonical orchestration topologies (flat conversation a la AutoGen, hierarchical SOP a la MetaGPT, role-playing a la CAMEL, DAG-based a la AFlow, and RL-orchestrated a la Evolving Orchestration) and evaluates them on 3+ existing benchmarks spanning coding (SWE-bench), web navigation (WebArena), and general assistance (GAIA). The hypothesis is that orchestration topology effectiveness is task-dependent: hierarchical outperforms flat on decomposable tasks, while flat outperforms hierarchical on tasks requiring iterative refinement. This would yield the first topology selection guide for practitioners.",
      "confidence": "HIGH"
    },
    {
      "gap_id": "GAP-002",
      "description": "Planning methods (CoT, ToT, GoT, Plan-and-Act) decompose tasks into execution steps but universally assume each step succeeds. Failure analysis papers (MAST, AgentError, Who&When) taxonomize how and where agents fail but offer no integration with planning loops. No paper proposes a planning architecture that monitors for failure signals mid-execution and dynamically replans, despite both research areas being highly active (9 planning papers, 4 failure papers, zero cross-cluster edges).",
      "cluster_a": {
        "name": "reasoning-planning",
        "description": "Approaches for enhancing LLM reasoning capabilities including chain-of-thought, tree/graph-structured exploration, self-refinement, planning decomposition, and long-horizon task planning.",
        "key_papers": [
          "ARXIV-2305.10601",
          "ARXIV-2503.09572",
          "ARXIV-2303.11366",
          "ARXIV-2308.09687",
          "ARXIV-2406.04271"
        ]
      },
      "cluster_b": {
        "name": "failure-robustness",
        "description": "Analysis and mitigation of LLM agent failures including failure taxonomies, automated attribution, debugging frameworks, and safety evaluation of deployed systems.",
        "key_papers": [
          "ARXIV-2509.25370",
          "ARXIV-2505.xxxxx",
          "ARXIV-2503.13657",
          "ARXIV-2602.17753"
        ]
      },
      "novelty_score": 9.0,
      "novelty_justification": "Zero cross-cluster citation edges between reasoning-planning and failure-robustness clusters. Co-citation proximity is zero. Temporal gap amplifies novelty: planning papers cluster around 2022-2024 while failure papers are all 2025, indicating the failure research emerged after planning methods were established but hasn't yet influenced planning design. Reflexion (ARXIV-2303.11366) handles trial-level self-correction but not step-level failure detection during plan execution. Plan-and-Act (ARXIV-2503.09572) separates planner from executor but includes no failure recovery mechanism.",
      "evidence": [
        "ARXIV-2305.10601",
        "ARXIV-2503.09572",
        "ARXIV-2509.25370",
        "ARXIV-2505.xxxxx",
        "ARXIV-2303.11366"
      ],
      "feasibility": {
        "score": 8,
        "assessment": "Both clusters provide clear baselines: planning methods (ToT, Plan-and-Act) and failure taxonomies (MAST, AgentError). Public failure datasets exist (MAST-Data with 1600+ annotated traces, AgentErrorBench from ALFWorld/GAIA/WebShop). Gap is well-scoped: integrate failure detection into a planning loop. Single-author feasible since it extends existing planning architectures rather than building from scratch. Main risk: defining 'failure signal' precisely enough for real-time detection during plan execution.",
        "required_resources": [
          "Baseline planning implementations (Plan-and-Act, ToT as reference)",
          "Failure trajectory datasets (MAST-Data, AgentErrorBench)",
          "Public benchmarks for end-to-end evaluation (ALFWorld, GAIA, WebShop)",
          "API access for LLM evaluation (if applicable)"
        ]
      },
      "recommended_framing": "Propose a failure-aware planning architecture that augments Plan-and-Act with three components: (1) a lightweight failure detector trained on MAST taxonomy signals that monitors execution at each plan step, (2) a replanning trigger that activates when failure probability exceeds a threshold, and (3) a plan repair module that uses the failure type to select an appropriate recovery strategy (retry, backtrack, decompose further, or escalate). The hypothesis is that failure-aware planning recovers 30-50% of tasks that would otherwise fail, validated on AgentErrorBench trajectories and GAIA tasks with injected failure points.",
      "confidence": "HIGH"
    },
    {
      "gap_id": "GAP-003",
      "description": "Tool-use research focuses exclusively on single agents learning API selection and invocation (Toolformer, Gorilla, ToolLLM, CodeAct), while multi-agent frameworks focus on agent-to-agent coordination (AutoGen, MetaGPT, ChatDev). Zero papers in either cluster address how multiple agents should coordinate shared tool access: tool delegation based on agent specialization, conflict resolution for concurrent API calls, distributed tool capability routing, and shared state management across agent-tool boundaries.",
      "cluster_a": {
        "name": "tool-use-grounding",
        "description": "Methods for enabling LLMs to learn, select, and invoke external tools and APIs, including self-supervised tool learning, code-based action spaces, and tool benchmarks.",
        "key_papers": [
          "ARXIV-2302.04761",
          "ARXIV-2305.15334",
          "ARXIV-2307.16789",
          "ARXIV-2402.01030",
          "ARXIV-2303.17580"
        ]
      },
      "cluster_b": {
        "name": "multi-agent-frameworks",
        "description": "Frameworks and architectures for orchestrating multiple LLM agents including conversation-based, SOP-based, role-playing, and hierarchical multi-agent systems for collaborative task solving.",
        "key_papers": [
          "ARXIV-2308.08155",
          "ARXIV-2308.00352",
          "ARXIV-2307.07924",
          "ARXIV-2308.10848",
          "ARXIV-2410.10762"
        ]
      },
      "novelty_score": 8.5,